tweet_id,username,text,tweet_date,tweet_url,search_term,lat,long,region
1241147958646587392,Kent Nishimura,What are @haileybranson’s thoughts on the corona-beard Mark has going on?,2020-03-20 23:41:47,https://twitter.com/kentnish/status/1241147958646587392,Corona,34.0522,-118.2437,LA
1241147127952072705,Housewives Tonight!,Just put on Full House for a change in tone and the episode I randomly picked is one where Uncle Jesse has a bad cold.  #Covid_19 #Corona,2020-03-20 23:38:29,https://twitter.com/WivesTonight/status/1241147127952072705,Corona,34.0522,-118.2437,LA
1241145519415504896,Joseph Limbaugh (Advanced Make-Believe),"I think we need a poetic name for covid-19. Like “the Red Death“ or “Captain Tripps.”  I’m thinking “Crown of Sand,” because corona means crown and it fills your lungs with sand.  Any other ideas? #Covid_19",2020-03-20 23:32:05,https://twitter.com/overdroid/status/1241145519415504896,Corona,34.0522,-118.2437,LA
1241143972942114816,Anika Karina,I got enough for today and am trying to just stay home even if I can go out but that’s a good idea for next time if that lady didn’t give me her corona!,2020-03-20 23:25:57,https://twitter.com/AnikaKarinaa/status/1241143972942114816,Corona,34.0522,-118.2437,LA
1241142860784652289,dominique9,"So then its easier to call it ""corona virus"" rather than making a statement that gives a racist asshole the power to belittle chinese Americans/ immigrants..cmon cousin,  u went to school, they both start with a C so finish pronouncing the word with ""orona""",2020-03-20 23:21:31,https://twitter.com/AmbrizAnaiz/status/1241142860784652289,Corona,34.0522,-118.2437,LA
1241141254462697472,dominique9,"It literally happened just the other day when I went to eat at a Chinese restaurant...a couple walked in and LITERALLY responded to the server with ""can i get anything that doesnt have the corona virus in it"" like wow, cmon people really",2020-03-20 23:15:09,https://twitter.com/AmbrizAnaiz/status/1241141254462697472,Corona,34.0522,-118.2437,LA
1241139723575283712,Sin Supreme,I'm just wondering does anyone personally know someone that caught Corona?,2020-03-20 23:09:04,https://twitter.com/2kSin/status/1241139723575283712,Corona,34.0522,-118.2437,LA
1241139693472722944,Michael Langdon,The only thing worse for this country than Corona Virus is the MSM Virus. https://twitter.com/lyndseyfifield/status/1240761466216734721 …,2020-03-20 23:08:56,https://twitter.com/mikewlangdon/status/1241139693472722944,Corona,34.0522,-118.2437,LA
1241139471883448320,Stay in the house ♥️🏡,"The Corona grocery store visit really speaks volumes about which snacks reign superior. 

For instance: all different variations of Cheeze-its- GONE!

Goldfish - still heavily stocked ",2020-03-20 23:08:04,https://twitter.com/kimoraland_/status/1241139471883448320,Corona,34.0522,-118.2437,LA
1241138986178899968,Anthony,@BBCR1 Danny I’m sooooo glad Music is immune to the corona Virus. Rave on world,2020-03-20 23:06:08,https://twitter.com/Craftysince1990/status/1241138986178899968,Corona,34.0522,-118.2437,LA
1241138445629579265,Lindsey Mendibles,Corona Virus or Covid-19. PLAIN AND SIMPLE! https://twitter.com/marcorubio/status/1240956919843565572 …,2020-03-20 23:03:59,https://twitter.com/RinzyRoo420/status/1241138445629579265,Corona,34.0522,-118.2437,LA
1238977430859034625,Marlitus_,Drink a corona a day to build that immunity! - tebby,2020-03-14 23:56:53,https://twitter.com/TheRealMarlitus/status/1238977430859034625,Corona,34.0522,-118.2437,LA
1238975660174934017,🦚,corona virus is an all encompassing blue ball,2020-03-14 23:49:51,https://twitter.com/cellabilotto/status/1238975660174934017,Corona,34.0522,-118.2437,LA
1238975073777618944,Jenifer Golden,"Hey friends and people I don’t know - if you’re bored, listen to my podcast @ComplicatedShow to learn all about dating & relationships! We’ll help you suck at it less so once this corona mess is over, you can get back out there!  https://podcasts.apple.com/us/podcast/its-complicated/id1052872037 …",2020-03-14 23:47:31,https://twitter.com/JeniferGolden/status/1238975073777618944,Corona,34.0522,-118.2437,LA
1238974696055394304,Sad girl 🕷🕸,Why did a bunch of 9-16 year old’s on tiktok attack me for asking for the names of the dead who died as a result of the corona virus... they got me with “because HIPPA Karen” “have you heard of HIPPA boomer?” Y’all a bunch of idiots lol deaths are public records ,2020-03-14 23:46:01,https://twitter.com/sadgirlthingz/status/1238974696055394304,Corona,34.0522,-118.2437,LA
1238974423081705472,Alexandra Berardi | Actor,"And they have bidets! Down to our last 2 rolls of toilet paper here! 

#coronapocalypse #Corona #CoronavirusUSAhttps://twitter.com/ivanamassetti/status/1238969550177284096 …",2020-03-14 23:44:56,https://twitter.com/xandraberardi/status/1238974423081705472,Corona,34.0522,-118.2437,LA
1238974116184461312,NBK MAGNUS,Moriah mills got corona,2020-03-14 23:43:42,https://twitter.com/Nbkmagnus/status/1238974116184461312,Corona,34.0522,-118.2437,LA
1238973701166514176,Revell Images,Corona pic.twitter.com/9iQi0VJl9R,2020-03-14 23:42:04,https://twitter.com/REVELLIMAGES/status/1238973701166514176,Corona,34.0522,-118.2437,LA
1238972789844930560,megan,I keep walking around the house singing “it’s corona time” and my mom just keeps looking at me with a confused look...,2020-03-14 23:38:26,https://twitter.com/purdy_odd/status/1238972789844930560,Corona,34.0522,-118.2437,LA
1238971618011025413,Quamirin,"My corona mood board @ Los Angeles, California https://www.instagram.com/p/B9u4616ADof/?igshid=1s5ttv3qn16dj …",2020-03-14 23:33:47,https://twitter.com/camiringordynn/status/1238971618011025413,Corona,34.0522,-118.2437,LA
1238971436720513024,sensitive thug,"Finna thro a Corona virus themed party, if I die I die",2020-03-14 23:33:04,https://twitter.com/RobertBenavidez/status/1238971436720513024,Corona,34.0522,-118.2437,LA
1238970677467721732,Dinorah Flores TV,"Después de la entrevista que le hice a @princeroyce él pasado martes 09 de Marzo para @sueltalasopatv , en donde dijo que NO cancelaría ningún concierto por la pandemia del Corona Virus, esto es lo que que publicó en… https://www.instagram.com/p/B9u4fpKFiq7/?igshid=oh07ljdejald …",2020-03-14 23:30:03,https://twitter.com/dinorahflorestv/status/1238970677467721732,Corona,34.0522,-118.2437,LA
1238970018001383424,NURR,I’m so boreddddd fuck corona virus,2020-03-14 23:27:25,https://twitter.com/caligirlnurr/status/1238970018001383424,Corona,34.0522,-118.2437,LA
1238968974676594688,Frank Hagan,"I'll look when I get back to a desktop computer. I recall my county having a disaster drill a couple of years ago for a virus. I think that was inspired by Ebola, and not Corona.",2020-03-14 23:23:17,https://twitter.com/FrankFshagan/status/1238968974676594688,Corona,34.0522,-118.2437,LA
1238968782095187968,panth ❊,I will die from corona faster then ZAYN putting his pride down.,2020-03-14 23:22:31,https://twitter.com/anthonyandpaul/status/1238968782095187968,Corona,34.0522,-118.2437,LA
1238968610929774592,⚾Anthony Moreno⚾,Drink Modelo. Don’t drink Coronas. You’ll get the Corona virus.,2020-03-14 23:21:50,https://twitter.com/XMVP13/status/1238968610929774592,Corona,34.0522,-118.2437,LA
1238968256444035075,lorena,"a mina aqui no aeroporto

""corona virus. how should I feel? terrified. how do I feel? amazingly happy""",2020-03-14 23:20:25,https://twitter.com/lorenaetal/status/1238968256444035075,Corona,34.0522,-118.2437,LA
1238968217411801088,Robert $tephan,How many Corona V cases are reported and or expected down in Tweeter Ville¿? – at Fluidity Therapeutic Massage,2020-03-14 23:20:16,https://twitter.com/RobertZawodski/status/1238968217411801088,Corona,34.0522,-118.2437,LA
1238967617517469696,Sina Amedson,For any friends in LA that are concerned about their kids losing the school lunches they are dependent on for meals. Please share to make sure no kids go hungry. #LA #corona #LAUSD #schoollunch #food #kids @ Santa… https://www.instagram.com/p/B9u3GkSAkKh/?igshid=18m5wz7tb4abr …,2020-03-14 23:17:53,https://twitter.com/SinaAmedson/status/1238967617517469696,Corona,34.0522,-118.2437,LA
1238615784856813569,☢️HARDCORE PAISA☣️,“i HaVe CoRoNa” https://twitter.com/Mufaa6/status/1238508395293847553 …pic.twitter.com/ClnzUrJAuX,2020-03-13 23:59:50,https://twitter.com/HardcorePaisa/status/1238615784856813569,Corona,34.0522,-118.2437,LA
1238615674299150336,pao,Who played “corona time” during lunch tho,2020-03-13 23:59:23,https://twitter.com/paoladeleonita/status/1238615674299150336,Corona,34.0522,-118.2437,LA
1238615548310589440,Khloë Terae 🇨🇦,Corona virus sadness ,2020-03-13 23:58:53,https://twitter.com/khloe/status/1238615548310589440,Corona,34.0522,-118.2437,LA
1238614248185450497,✨Deanna Claire✨,"This corona virus is interfering with my students education, alright fine but, listen here COVID-19 if you dare TOUCH @DoveCameron, it’s fucking over!",2020-03-13 23:53:43,https://twitter.com/ddclaire_12/status/1238614248185450497,Corona,34.0522,-118.2437,LA
1238613586735292417,desempregada,ja cheguei e estoquei comida pq pobre tem medo de morrer de fome ne de corona nao,2020-03-13 23:51:06,https://twitter.com/suilaneoliveira/status/1238613586735292417,Corona,34.0522,-118.2437,LA
1238612236727287809,"Thank you Mikey, very cool!","If I don't shake your hand, it's not because I'm afraid of the Corona virus.

It's because TP is sold out every where and I know some of yall be using your hands.",2020-03-13 23:45:44,https://twitter.com/MikeyP_Powelson/status/1238612236727287809,Corona,34.0522,-118.2437,LA
1238611831444275202,Kitmaker92,O Corona não encara uma Estação Santo Amaro as 18hs de um dia chuvoso...nem fudendo kkkkkkk,2020-03-13 23:44:07,https://twitter.com/ToadTorres92/status/1238611831444275202,Corona,34.0522,-118.2437,LA
1238611550803341313,Freddy Lopez,So for those that havent heard the news the corona virus will be at the costco in norwalk tomorrow around 4:00 pm so dont go to it avoid it till about 5 pm thanks,2020-03-13 23:43:00,https://twitter.com/Trickz_43/status/1238611550803341313,Corona,34.0522,-118.2437,LA
1238610934387507200,☠️🖤Kali📸💛💜,They all got the corona virus now,2020-03-13 23:40:33,https://twitter.com/KaliJones323/status/1238610934387507200,Corona,34.0522,-118.2437,LA
1238610681156403200,☠️🖤Kali📸💛💜,Colonizers never serious ... until that corona virus hit one of their family members,2020-03-13 23:39:33,https://twitter.com/KaliJones323/status/1238610681156403200,Corona,34.0522,-118.2437,LA
1238610258878054400,Eli,All y’all being stupid... watch the IE bouta catch a case of this corona virus ima call it now. https://twitter.com/imbadadab/status/1238599097759584256 …,2020-03-13 23:37:52,https://twitter.com/CommonVisuals/status/1238610258878054400,Corona,34.0522,-118.2437,LA
1238610189747548160,Christine Wu,I’m calling it now- the Corona 15.  From everybody stress eating the whole store.  #CoronaApocalypsepic.twitter.com/da6pjgpVGR,2020-03-13 23:37:36,https://twitter.com/xtinewu/status/1238610189747548160,Corona,34.0522,-118.2437,LA
1238610138329542656,Nicole Moreno,CONTAGION IS LITERALLY THE CORONA VIRUS .... uhhhh  https://twitter.com/PrimaryReezin/status/1238592014507102209 …,2020-03-13 23:37:23,https://twitter.com/nic0lem__/status/1238610138329542656,Corona,34.0522,-118.2437,LA
1238610098986999809,Keeks,Can someone pls tell corona to stop having the virus,2020-03-13 23:37:14,https://twitter.com/technicolor____/status/1238610098986999809,Corona,34.0522,-118.2437,LA
1238609974126936066,Beny Mena,"Hey everyone, I know there has been some new developments with the Corona virus and the state of emergency. But we ARE STILL HAVING MY BIRTHDAY COMEDY BASH laughfactorylbc this Sunday, March 15th at 7:45 pm.… https://www.instagram.com/p/B9sTEytgoIX/?igshid=1wonu26uu4679 …",2020-03-13 23:36:44,https://twitter.com/BenyMena/status/1238609974126936066,Corona,34.0522,-118.2437,LA
1238608638786162689,David Lucas,"I went to Whole foods and saw White ppl buying up all the Kale and Quinoa, what corona party you about to ruin Pam ??",2020-03-13 23:31:26,https://twitter.com/funnydavidlucas/status/1238608638786162689,Corona,34.0522,-118.2437,LA
1238608220664385538,Juan J. Montoya⚡️,"Corona virus hitting so hard, you start talking to yourself  #prayforevelynhttps://twitter.com/pyt_eveeee/status/1238607334391164928 …",2020-03-13 23:29:46,https://twitter.com/jayyskywalker_/status/1238608220664385538,Corona,34.0522,-118.2437,LA
1238608124920999936,wow,I know Jhené Aiko booty sweat is the cure to the corona virus,2020-03-13 23:29:23,https://twitter.com/ThatsLudaChriss/status/1238608124920999936,Corona,34.0522,-118.2437,LA
1238607790316249089,ScottyD_da_Logical_Dem,"So you can walk into a Corona virus infested city you've never been to before, know no one, and you will come out healthy. Trumpadump is so smart",2020-03-13 23:28:04,https://twitter.com/Scottydt1d/status/1238607790316249089,Corona,34.0522,-118.2437,LA
1238607744522846208,Colman Roy,If people feared going to Hell as much as they fear the Corona Virus. There would be more people coming to Jesus,2020-03-13 23:27:53,https://twitter.com/cjmastermind/status/1238607744522846208,Corona,34.0522,-118.2437,LA
1240064094293471232,Reyna ❣️,"When I was younger, I used to be scared of la llorona. But now, I’m scared of the corona",2020-03-17 23:54:54,https://twitter.com/reyna_lara16/status/1240064094293471232,Corona,34.0522,-118.2437,LA
1240063492545105920,Ray,Niggas really think this corona virus shit is gonna stop me from making $. Ha nigga pls I’m outside.,2020-03-17 23:52:30,https://twitter.com/DOGAMUSPRIME/status/1240063492545105920,Corona,34.0522,-118.2437,LA
1240063435968098306,ur god,yo is this Corona virus curfew shit real,2020-03-17 23:52:17,https://twitter.com/lilspice666/status/1240063435968098306,Corona,34.0522,-118.2437,LA
1240062285508378625,Paul Roseberry,"Apocalypse food difference in this house, Chelsea on the right, me on the left, kinda the same but different, sorta
.
.
.
.
#corona #apocalypse #food #pizza chelsea_rose_lanham @ Los Angeles, California https://www.instagram.com/p/B92o5hmA-31/?igshid=1szwpmjivd9mc …",2020-03-17 23:47:42,https://twitter.com/PaulRoseberry/status/1240062285508378625,Corona,34.0522,-118.2437,LA
1240062208937246723,The TeaBook,"Giving blood because all the blood drives have been cancelled and they need it. Go to your local blood place still open. My blood type Is be positive.. with markers bergamot and chai. 

#tea #corona #helpothers #blooddrive #sterile #earlgrey #dogood #quarinTEAnd #caring.pic.twitter.com/BI6Cm7nwMv",2020-03-17 23:47:24,https://twitter.com/TheTeaBook/status/1240062208937246723,Corona,34.0522,-118.2437,LA
1240062090330566657,💫 ™,i have to wait until fucking July for the NBA to come back. i’m gonna FUCKING CRY. fuck this corona bitch.,2020-03-17 23:46:56,https://twitter.com/loveadamhann/status/1240062090330566657,Corona,34.0522,-118.2437,LA
1240061922709397504,The_Rice_Machine,"Curling cement bags, barstool dips, hand stand pushups #corona workout",2020-03-17 23:46:16,https://twitter.com/JKimz17/status/1240061922709397504,Corona,34.0522,-118.2437,LA
1240061662628962304,Smart DOG Never Bites Human beings TARGET,Https://one.Google.com   U.S. in CA Robert gov jury Brown he was said. Who knows his family Jewish people's for average person fosters care his hair grow. CEDARS _SINAL hospital dined for protocol corona virs Strio average person endoscopy appointment.. pic.twitter.com/DuCIbCJert,2020-03-17 23:45:14,https://twitter.com/WStraio/status/1240061662628962304,Corona,34.0522,-118.2437,LA
1240061328674308096,Jenna,@Linktree_ just curious if Instagram is blocking other profiles from using linktree links in their bio?!!! Super annoying. Another Instagram fail. Let’s hope ig disappears with the corona virus!,2020-03-17 23:43:54,https://twitter.com/jennasroom/status/1240061328674308096,Corona,34.0522,-118.2437,LA
1240060208832892929,The Essential Dude,Irish I was a rich celebrity with access to corona virus testing,2020-03-17 23:39:27,https://twitter.com/el_duderino8184/status/1240060208832892929,Corona,34.0522,-118.2437,LA
1240060108089905153,Smart DOG Never Bites Human beings TARGET,http://Canada.com  Canada  FBI  they was staid. U.S. in CA  in Beverly hills one  CEDARS Sinai HOSPITALS  U.S. JEWISH PEOPLE'S  FOSTERS CARE FAMILY FOR AVERAGE P HIS HAIR GROW .they knows his stomach food terrorism. The hospital dined  patient for protocol corona virs Strio,2020-03-17 23:39:03,https://twitter.com/WStraio/status/1240060108089905153,Corona,34.0522,-118.2437,LA
1240059976435077120,"Cloud Bookkeeping, Inc.","Do's and Dont's - Things you should not do during the coronavirus outbreak!  #fightagainstcoronavirus .
.
.
.
.

#Coronavirus #corona #covid #covid19 #covid_19 @ Ontario, California https://www.instagram.com/p/B92mq6iF5H-/?igshid=1047t99k8azrb …",2020-03-17 23:38:32,https://twitter.com/CBICalifornia/status/1240059976435077120,Corona,34.0522,-118.2437,LA
1240059298924752896,♡Les,the odds of me going insane are higher bc I’m home with my family (bc they’re crazy) than it is bc of the corona virus,2020-03-17 23:35:50,https://twitter.com/_xolesley/status/1240059298924752896,Corona,34.0522,-118.2437,LA
1240058991738155008,♚ Kekoa ♚,I WAITED 21 YEARS FOR THIS SHIT. I WILL OPEN A SPEAKEASY BEFORE I DONT GET DRUNK WITH MY FRIENDS ON MY BIRTHDAY. CORONA VS CORONA PUTA https://twitter.com/itspapikay/status/1239626517371654145 …,2020-03-17 23:34:37,https://twitter.com/GriffinE72/status/1240058991738155008,Corona,34.0522,-118.2437,LA
1240058942731874305,james!,Corona OG,2020-03-17 23:34:25,https://twitter.com/JediJames_/status/1240058942731874305,Corona,34.0522,-118.2437,LA
1240058382192480257,disco slut,It’s also st patty’s day and no one is talking about bc of stupid corona so go pinch anyone who isn’t wearing green,2020-03-17 23:32:12,https://twitter.com/skahrbb/status/1240058382192480257,Corona,34.0522,-118.2437,LA
1240058245160599553,Renyere Lima," Tranquem as portas!! em Corona Hills, Corona https://www.instagram.com/p/B92nD1zp1AN/?igshid=1wcev56oacgwi …",2020-03-17 23:31:39,https://twitter.com/renyere/status/1240058245160599553,Corona,34.0522,-118.2437,LA
1240058159688908800,Alex Thornton,"I keep thinking that, then I remember Corona is actually 2019’s parting f-you to us all.",2020-03-17 23:31:19,https://twitter.com/Atpthornton/status/1240058159688908800,Corona,34.0522,-118.2437,LA
1238253395951202305,MOHAMED KARIM,"THE EGYPTIAN CORONA PRECAUTION SONG  

For all who can understands Arabic listen to the Precautions in the song .
.
#WeNeedToRelax #coronaBreak #DontFreakout #coronadance #precautions #coronavirus… https://www.instagram.com/p/B9ptz_YBeXX/?igshid=ydww4y433k71 …",2020-03-12 23:59:49,https://twitter.com/mokarimstar/status/1238253395951202305,Corona,34.0522,-118.2437,LA
1238253344369639426,Naaathalie Anaahi,"Fuck this corona virus
First we’re switched to online classes   
& now I’m jobless",2020-03-12 23:59:37,https://twitter.com/_hnaathalie/status/1238253344369639426,Corona,34.0522,-118.2437,LA
1238252799940583428,Marcelino Hanway,I just walked back to my inn  from @littlecaesars  but I’m watching the news and the Corona virus  is all they’re talking about and it’s scaring me.  https://twitter.com/spencermusic/status/1238215896251813890 …,2020-03-12 23:57:27,https://twitter.com/marcel_hanway/status/1238252799940583428,Corona,34.0522,-118.2437,LA
1238252709452623872,🧚🏻‍♀️,"If this hoe ass Corona takes out one more of my music events, imma roll up on her  Swear to God",2020-03-12 23:57:06,https://twitter.com/jtpph/status/1238252709452623872,Corona,34.0522,-118.2437,LA
1238252494226153478,Toledrcv_23,The corona virus is closing places down shit if they close my job corona virus better pay for my fucking bills,2020-03-12 23:56:14,https://twitter.com/Toledrcv2/status/1238252494226153478,Corona,34.0522,-118.2437,LA
1238252447367299074,qwis,I’ll hit my pen and cough and then boom corona,2020-03-12 23:56:03,https://twitter.com/TubbyAsian/status/1238252447367299074,Corona,34.0522,-118.2437,LA
1238251929081430016,Rachel Charles,"10-0,6KO’s @aaronmck99 and 4-0,4KO’s about to jump on with @thaboxingvoice at 5pm. #radio #thaboxingvoice #talk #boxingtalk #fightlife #coronavirus #corona #standstill #fightsoff #cancelledpic.twitter.com/o4RkKcs1Hk",2020-03-12 23:54:00,https://twitter.com/PitchInk/status/1238251929081430016,Corona,34.0522,-118.2437,LA
1238251470849544198,Dallas🦠,Fuk the toilet paper I’m stocked up on tomato soup for corona,2020-03-12 23:52:10,https://twitter.com/DallasCastro10/status/1238251470849544198,Corona,34.0522,-118.2437,LA
1238251230968926214,Ahyleen 🌊,He’s prepared to give his speech at the corona virus meeting to make this all go away pic.twitter.com/o9PM61R2pd,2020-03-12 23:51:13,https://twitter.com/nitocatt/status/1238251230968926214,Corona,34.0522,-118.2437,LA
1238251208189587458,Laith🇵🇸,"If corona doesn’t take you out, can I? pic.twitter.com/EuMtmtEGat",2020-03-12 23:51:08,https://twitter.com/laithalishious/status/1238251208189587458,Corona,34.0522,-118.2437,LA
1238251051683319809,Abraham Rosas,Gracias corona virus por todo este pedo y yo el sábado quería ir a six flags hdtpm,2020-03-12 23:50:30,https://twitter.com/AbrahamRosas96/status/1238251051683319809,Corona,34.0522,-118.2437,LA
1238250992254234625,Besus,Ohhhhhh only people from San Bernardino go to beyond right? No one from LA/Orange County or out of state go? Lmao this like those people that think Corona beer gives you virus. Lmao be logical it’s public safety precautions! https://twitter.com/edmphobia/status/1237976802200399873 …,2020-03-12 23:50:16,https://twitter.com/notyourchrist/status/1238250992254234625,Corona,34.0522,-118.2437,LA
1238250786905378816,sierra,I can’t believe the corona virus only infects women wtf https://twitter.com/Complex/status/1238166900963713024 …,2020-03-12 23:49:27,https://twitter.com/sierraouslyyy/status/1238250786905378816,Corona,34.0522,-118.2437,LA
1238250479051771910,Greg Rodney,"Corona virus , Miley Cyrus , Plus and Minus doesn’t matter Lakers in.... shit",2020-03-12 23:48:14,https://twitter.com/premejuice/status/1238250479051771910,Corona,34.0522,-118.2437,LA
1238249641260519425,Nick Schaffer,If someone wants to take me out before the corona virus does I’m all for it ,2020-03-12 23:44:54,https://twitter.com/DJ_unknown11/status/1238249641260519425,Corona,34.0522,-118.2437,LA
1238249612705763328,emma,“if you let me dye your hair rn the corona virus won’t recognize you” -cristina,2020-03-12 23:44:47,https://twitter.com/emmaluellab/status/1238249612705763328,Corona,34.0522,-118.2437,LA
1238249526672097281,iluvher,Out here at the dirty ass hp gym ain't even trippin cause if I catch corona ima lose like 20 pounds anyway; basically in a win-win scenario,2020-03-12 23:44:27,https://twitter.com/_Crunchfucious/status/1238249526672097281,Corona,34.0522,-118.2437,LA
1237890793349607424,DonChino,apparently the corona virus is lethal to populations age 60+. Y’all wanted the old politicians to die and more jobs to open up well here ya go ,2020-03-11 23:58:58,https://twitter.com/itsWillylai/status/1237890793349607424,Corona,34.0522,-118.2437,LA
1237890310333595648,Penelope,I’m about to tell my work I have corona virus just so I can book ‘em all ,2020-03-11 23:57:03,https://twitter.com/pennepastaaa/status/1237890310333595648,Corona,34.0522,-118.2437,LA
1237889950311280642,ScottyD_da_Logical_Dem,"How much does Trump know about virus spreading? He's talking like it will just go away. I wish he knew about the common cold. (it's a virus) it spreads rapidly, & you can't stop it.
The Corona virus just started in the US, will it just stop?",2020-03-11 23:55:37,https://twitter.com/Scottydt1d/status/1237889950311280642,Corona,34.0522,-118.2437,LA
1237889739853717508,Robin Redd,"#ohmygoodness!  I adore these shoes!  And, they are having a #duckfeetusagiveaway!  Crossing fingers!  @ Corona, California https://www.instagram.com/p/B9nM8JXAlIO/?igshid=19eyogxwqil7y …",2020-03-11 23:54:47,https://twitter.com/RockinReddRobin/status/1237889739853717508,Corona,34.0522,-118.2437,LA
1237889124901634049,.,The Corona virus is a hoax. I will have it under control by Spring  https://twitter.com/realDonaldTrump/status/1237861968721010689 …,2020-03-11 23:52:20,https://twitter.com/LADFan4Life/status/1237889124901634049,Corona,34.0522,-118.2437,LA
1237888888242188290,HR 961 S2006 SAVE HORSES AND BURROS FROM SLAUGHTER,"THE DOCTORS OFFICES IN CALIFORNIA DO NOT HAVE TESTING KITS FOR CORONA VIRUS.
THE HOSPITALS ARE NOT TESTING 
UNLESS THEY GO BY A STRICT PROTOCAL MAKING IT DIFFICULT FOR PATIENTS TO BE TESTED.
THE GOVERNMENT IS LYING ABOUT PLENTY OF KITS ALL OVER.",2020-03-11 23:51:24,https://twitter.com/foxmoorestates/status/1237888888242188290,Corona,34.0522,-118.2437,LA
1237887949980577794,marisa,I don’t have corona I’m just saying with how much people are up in arms about it I wish I did so I could die and stop hearing about it.,2020-03-11 23:47:40,https://twitter.com/ballenasesina/status/1237887949980577794,Corona,34.0522,-118.2437,LA
1237887782590111744,Angela C. Ovalle,Adding to the list of things I’m glad I had a chance to do before Corona virus - going to Sacramento and touching @BacteriaBear.  The other is going to Italy last year and seeing a Papal audience.https://twitter.com/CA_Talks/status/1237883334404890624 …,2020-03-11 23:47:00,https://twitter.com/Angela_Ovalle/status/1237887782590111744,Corona,34.0522,-118.2437,LA
1237887143596290048,anna,i’m so over this corona virus bs,2020-03-11 23:44:28,https://twitter.com/annnaxoxo97/status/1237887143596290048,Corona,34.0522,-118.2437,LA
