tweet_id,username,text,tweet_date,tweet_url,search_term
1237809279811215360,Kevin A. Madden,"Here’s the thing:

If we told the typical #GOP/#Republican/# voter that the White House told federal health agency to classify #coronavirus deliberations https://www.reuters.com/article/us-health-coronavirus-secrecy-exclusive-idUSKBN20Y2LM …, they 

a) won’t see the problem with that, or 

b) would think it the right tactic.

#madness",2020-03-11 18:35:04,https://twitter.com/KevinTheCapSF/status/1237809279811215360,Coronavirus
1237808399384842240,JJ,Labcorp and quest both provide coronavirus test now. Ask doctor to order test from them instead of government. https://twitter.com/JSODonoghue/status/1237562508258340869 …,2020-03-11 18:31:34,https://twitter.com/jjustc/status/1237808399384842240,Coronavirus
1237808388009947136,BLVCKSTVR,"Dear Antivaxxers,

If we find the cure for coronavirus, you can’t have it. Maybe Vick’s on your chest and honey tea will help you.

Warm regards,
People who get Vaccinated",2020-03-11 18:31:31,https://twitter.com/BLVCKxSTVR/status/1237808388009947136,Coronavirus
1237808166420615168,kalikrome,"https://youtu.be/bDKsZnG6r1A 
Another delayed response from an underfunded and possibly mismanaged agency from the inept trump administration. Don't forget the dismantling of the pandemic response team in 2018 or the 
#TrumpVirusCoverup
#coronavirus
#ByeByeTrump
#VoteBlueNoMatterWho",2020-03-11 18:30:38,https://twitter.com/Kalikrome/status/1237808166420615168,Coronavirus
1237808076352188416,🖤🥀,Lmao my manager at my second job doesn’t want me coming in for the next 2 weeks because I flew out of San Jose airport & she saw an article that there were 3 TSA screeners tested positive for coronavirus  now I’m gonna be broke broke,2020-03-11 18:30:17,https://twitter.com/DreaLaSoul/status/1237808076352188416,Coronavirus
1237807189097668608,Brian Shlonsky,#BREAKINGNEWS on Coronavirus: No fans expected to be in the stands for tomorrow’s Golden State Warriors game. pic.twitter.com/MvDpL6NJzg,2020-03-11 18:26:45,https://twitter.com/BrianWAVE3TV/status/1237807189097668608,Coronavirus
1237807172752269312,Larry Beil,#Warriors will play Nets tomorrow night @ChaseCenter with NO FANS allowed in arena due to #coronavirus.,2020-03-11 18:26:41,https://twitter.com/LarryBeilABC7/status/1237807172752269312,Coronavirus
1237805829799071749,Prajakta Tathavadkar,#coronavirus pic.twitter.com/9b7zJThI8C,2020-03-11 18:21:21,https://twitter.com/praajaktaa1/status/1237805829799071749,Coronavirus
1237805333034106880,"Joey Esplanada, Realtor®️",#dubnation #coronavirus #nbahttps://twitter.com/anthonyVslater/status/1237804970734317568 …,2020-03-11 18:19:23,https://twitter.com/JoeyEspy_RE/status/1237805333034106880,Coronavirus
1237805071980584960,Sailing Free,"Media generated hysteria over Corona Virus, acts li kn e NY Gov calling out National Guard  China style quarrenteen of New Rochelle will generate more deaths than virus, as people commit acts of desperation, even suicide, hundreds more die every hour from common flu than  COVID19",2020-03-11 18:18:21,https://twitter.com/JimsBT510/status/1237805071980584960,Coronavirus
1237805067966676993,September Williams,Johns Hopkins Experts Brief Capitol Hill on Coronavirus (COVID-19) https://youtu.be/Pnk8DuAly9Y  via @YouTube,2020-03-11 18:18:20,https://twitter.com/bioethicsscreen/status/1237805067966676993,Coronavirus
1237804938287169536,Jenica Jones,I made this flyer for my show on Sunday... Hoping it doesn’t get canceled for the coronavirus! #IDrewThat #BATSFlyerpic.twitter.com/sRDSIvCcAX – at BATS Improv,2020-03-11 18:17:49,https://twitter.com/jenicaviolet/status/1237804938287169536,Coronavirus
1237804699648065536,Dish Washer ( DJ) Omarbarrera,Ya los mismos de siempre dando asco!! Sacando raja politica del coronavirus... era de esperarse.. en su desesperacion ideologica... estupida!!!,2020-03-11 18:16:52,https://twitter.com/Omarbar67441882/status/1237804699648065536,Coronavirus
1237804691129430016,dedrick,How do you feel about coronavirus?,2020-03-11 18:16:50,https://twitter.com/boydedrick/status/1237804691129430016,Coronavirus
1237803811973914624,quarentine queen,"As an intern for public health, the past days Ive been answering calls from ppl afraid of the corona virus & helping them either find resources or be someone to just listen. 

Overall it’s been extremely stressful for me. So this is my form of self-care just tweeting how I feel",2020-03-11 18:13:20,https://twitter.com/kneeekole/status/1237803811973914624,Coronavirus
1237803147478700032,María Alejandra Lozano,El coronavirus me va dejar sin trabajo !,2020-03-11 18:10:42,https://twitter.com/marialelozanod/status/1237803147478700032,Coronavirus
1237801853653381120,Braeden ❂,"I need something good to happen to me this week, like trump dying from the corona virus or something",2020-03-11 18:05:33,https://twitter.com/brae_22/status/1237801853653381120,Coronavirus
1237801028566675456,"Amir M Pirmoazen, MD","To all my twitter friends and radiology family: Please take #coronavirus #pandemic seriously. Many people, including young health care workers in my home country, Iran, are dying from #COVID19 due to public negligence and underestimation.pic.twitter.com/trRz2kyTFt – at Stanford Health Care",2020-03-11 18:02:17,https://twitter.com/AmirPirmoazenMD/status/1237801028566675456,Coronavirus
1237800770864463872,Jana'moe Elis,"I don’t give a fuck about no coronavirus. I’m on that flight, cruise, train whatever lmao",2020-03-11 18:01:15,https://twitter.com/GambinoFi7Mini/status/1237800770864463872,Coronavirus
1237800099184443392,Sam Hustis,Anyone else thing there's a small possibility that Kevin Durant may have started coronavirus in a long and complicated plan to give himself an excuse so he doesn't have to show up for tomorrow's Warriors/Nets game? Cmon someone had to say it,2020-03-11 17:58:35,https://twitter.com/SamHustis/status/1237800099184443392,Coronavirus
1237799768643911682,CCSFStudentSays,Unfortunate bad timing right now to push for this while the @WHO declared coronavirus a pandemic and our Public Health Dept is asking people to practice social distancing and cancelling all gatherings with more than 50 people.,2020-03-11 17:57:16,https://twitter.com/CCSFStudentsays/status/1237799768643911682,Coronavirus
1237799213921996801,Dish Washer ( DJ) Omarbarrera,"Alguien aficionado a las teorias conspirativas , me comento.. ""el coronavirus lo crearon en laboratorios chinos secretos.. con el fin de innocularlo a la gente.. para reducir la poblacion...pero se les salio de control, lo de la SOPA de murcielago es leyenda urbana""  sera?",2020-03-11 17:55:04,https://twitter.com/Omarbar67441882/status/1237799213921996801,Coronavirus
1237799181902688256,John Panzer,"This is BS.  The coronavirus does not read reports.  Keeping information about it secret is clearly not necessary for national security, and it hampers national response.

This is abuse of classification power.",2020-03-11 17:54:56,https://twitter.com/jpanzer/status/1237799181902688256,Coronavirus
1237798373085679618,^THICKARRY DUFF^,Thotting on Coronavirus be like: pic.twitter.com/a7irHMxz7e,2020-03-11 17:51:43,https://twitter.com/TonyNativ/status/1237798373085679618,Coronavirus
1237798331276865536,Alejandro Galicia,#BREAKING #SanFrancisco #California #BayArea #coronavirus #COVID19https://twitter.com/abc7newsbayarea/status/1237797668912496642 …,2020-03-11 17:51:34,https://twitter.com/agaliciadiaz_/status/1237798331276865536,Coronavirus
1237798149885816832,Nick,Coronavirus is officially a pandemic,2020-03-11 17:50:50,https://twitter.com/storytellinnick/status/1237798149885816832,Coronavirus
1237797888194830336,homes_by_yohannes,"It’s still early, but several #Airbnb property owners are expressing fears of keeping up with payments for their vacation homes because of cancellations as a result of Coronavirus fears.",2020-03-11 17:49:48,https://twitter.com/homesbyyohannes/status/1237797888194830336,Coronavirus
1237797813867565056,mareá,todo mundo trabalhando em casa na crise do corona virus menos eu q trabalho num barco q passam mais de 600 turistas toda hora de todos os lugares do mundo ,2020-03-11 17:49:30,https://twitter.com/tudomainstream/status/1237797813867565056,Coronavirus
1237797699639894017,Devante,I had to park in the shopping plaza across the street from work because of this stupid coronavirus,2020-03-11 17:49:03,https://twitter.com/devthestallion/status/1237797699639894017,Coronavirus
1237797678118875138,Helton Souza,"A Organização Mundial de Saúde acaba de escalar o #COVID19 Corona Vírus, como Pandemia.

https://www.pscp.tv/w/cTfJyDFxTFFHQnhwa0FKRUp8MWRqeFhRa3FBcFZLWvlr7E-SBSEGEZuRafcfK5Y9InxQoPnNkxdCRwGNl-7h …",2020-03-11 17:48:58,https://twitter.com/helton_souza/status/1237797678118875138,Coronavirus
1237797425877667840,Viewfrommyside,they last longer than the coronavirus just remember that,2020-03-11 17:47:58,https://twitter.com/viewfrommyside/status/1237797425877667840,Coronavirus
1237796322536615937,veralyn,#TameImpala guess we in San Francisco won't be able to see them Friday due to the ban on large events  be safe everyone #coronavirus #pandemic,2020-03-11 17:43:35,https://twitter.com/st8ygold/status/1237796322536615937,Coronavirus
1237795970047328261,Jerold 🚃🚈🚍,"Breaking: San Francisco has issued a moratorium on large gatherings of 1,000 people or more to slow the spread of the coronavirus. @sfbay",2020-03-11 17:42:11,https://twitter.com/Jerold_Chinn/status/1237795970047328261,Coronavirus
1237795673266769920,James Tobyne (任翔）,Great commentary from @S_Rabinovitch — absolutely fascinating that anyone is billing China’s markets as a global safe haven just because they are announcing the Coronavirus is under control in China (based on the data they selectively release and revise). https://twitter.com/S_Rabinovitch/status/1237645887523840001 …,2020-03-11 17:41:00,https://twitter.com/JamesTobyne/status/1237795673266769920,Coronavirus
1237794451189194754,David McGreavy,"The amount of articles I've read mentioning the 

NOVEL CORONAVIRUS

is incredible.

Good grief everyone, it's not especially novel, and I'm not sure why everyone is choosing that term. It's like everyone's copying someone else's homework and thinks ""that'll do"".",2020-03-11 17:36:08,https://twitter.com/DominusNoctis/status/1237794451189194754,Coronavirus
1237793756801191941,Aaron Trank,I predict that after this coronavirus pandemic is over most people STILL won’t understand how compound interest works,2020-03-11 17:33:23,https://twitter.com/AaronTrank/status/1237793756801191941,Coronavirus
1237793501191884801,Kinder Politics 🌹,"So you think the Democratic Party Establishment isn’t corrupt? Haha is that what you’re alluding to? Haha

I’m truly done with you now. Have a good day. Stay clear of the Coronavirus, we wouldn’t want Joe to lose another elderly voter ",2020-03-11 17:32:22,https://twitter.com/Kinder_Politics/status/1237793501191884801,Coronavirus
1237793421407870978,irma,coronavirus is just exposing how much this office hates its employees,2020-03-11 17:32:03,https://twitter.com/IrmaAdelinee/status/1237793421407870978,Coronavirus
1237793294270091264,Victory Lap ™️©️,I’ve been dealing with anxiety for over 10 years now & this corona virus shit is making it worse,2020-03-11 17:31:33,https://twitter.com/TjaderDaRaider/status/1237793294270091264,Coronavirus
1237792947027861505,The Sage Grouse,"Don't wait for testing:  Self-distance.

Don't get it / don't spread it.

#SelfDistance
#flatteningthecurve #FlattenTheCurve #COVID19 #coronavirus #Corona #CloseTheSchools",2020-03-11 17:30:10,https://twitter.com/MaybeImALeo/status/1237792947027861505,Coronavirus
1237792880783065089,Dish Washer ( DJ) Omarbarrera,Y ya algunos tomando raja politica de la emergencia del coronavirus...,2020-03-11 17:29:54,https://twitter.com/Omarbar67441882/status/1237792880783065089,Coronavirus
1237792190199263232,Mai🤎,my mom rlly said the corona virus is another reason I should’ve chosen to become a nurse lmfao I fucking hate it here!!!!!,2020-03-11 17:27:09,https://twitter.com/maweeeahh/status/1237792190199263232,Coronavirus
1237791993595494402,Fatima Navarrete,"Baños portátiles con inodoros, lavamanos se han desplegado Ena ciudad para que residentes cumplan con las normas de higiene ante el brote de coronavirus. https://twitter.com/SF_emergency/status/1237453261474598918 …",2020-03-11 17:26:22,https://twitter.com/FNavarreteTV/status/1237791993595494402,Coronavirus
1237791328882159616,AC,on today’s episode of do i have the corona virus or is my immune system just wack...,2020-03-11 17:23:44,https://twitter.com/andrea_clapp/status/1237791328882159616,Coronavirus
1237790808842981376,Bong Tongol,"PRAYER IN THE TIME OF CORONAVIRUS
Jesus Christ, you traveled through towns & villages curing every disease and illness. At your command, the sick were made well. Come to our aid now, in the midst of the global spread of the coronavirus, that we may experience your healing love. pic.twitter.com/rFuEjO0YBd",2020-03-11 17:21:40,https://twitter.com/BongTongol/status/1237790808842981376,Coronavirus
1237790388418560001,Sailing Free,"WHO announces that Corona Virus is all over the world, really BFD  WHO was MIA for MERS, SARS, EBOLA and once again just pontificating from their plush offices and will spend our tax dollars on meetings,  lunches, hotels and first class airfare, and do nothing of any consequence",2020-03-11 17:20:00,https://twitter.com/JimsBT510/status/1237790388418560001,Coronavirus
1237790191781281792,Steven Babb,like there’s no coronavirus in the East Bay?,2020-03-11 17:19:13,https://twitter.com/BabbSports/status/1237790191781281792,Coronavirus
1237789925774200834,Marcus East,A very insightful article about the Coronavirus. This is the most useful analysis I’ve seen so far and hopefully you’ll all find it useful too... #COVID19 #coronavirus #datahttps://link.medium.com/gzFYsBtZL4 ,2020-03-11 17:18:09,https://twitter.com/marcuseast/status/1237789925774200834,Coronavirus
1237789632386838533,Maya,"""Coronavirus: WHO classifies COVID-19 as a pandemic"" #Coronavirus https://twitter.com/i/events/1219057585707315201 …",2020-03-11 17:17:00,https://twitter.com/mayaayana/status/1237789632386838533,Coronavirus
1237789105334837248,Brad Belstock,Just drove from Walnut Creek to San Jose in 50 minutes. During the commute. This is not normal. It usually takes MUCH longer. #coronavirus keeping everyone at home and off the roads.,2020-03-11 17:14:54,https://twitter.com/BradBelstock/status/1237789105334837248,Coronavirus
1237788173268209664,Judy Ambers,Shout out to all the talk shows today starting to do their shows with no audience!  @WendyWilliams @LiveKellyRyan @TheView #coronavirus,2020-03-11 17:11:12,https://twitter.com/iamjujub/status/1237788173268209664,Coronavirus
1237787545494114304,September Williams,Coronavirus expert: 'War is an appropriate analogy' https://youtu.be/dcJDpV-igjs  via @YouTubef,2020-03-11 17:08:42,https://twitter.com/bioethicsscreen/status/1237787545494114304,Coronavirus
1237786860031586304,Victor Li,"""Coronavirus: WHO classifies COVID-19 as a pandemic"" #Coronavirus #COVID19https://twitter.com/i/events/1219057585707315201 …",2020-03-11 17:05:59,https://twitter.com/victorlifeboyli/status/1237786860031586304,Coronavirus
1237786201370705920,Jeremy Flores,Good. #SanFrancisco #coronavirus #Warriorshttps://twitter.com/BleacherReport/status/1237785700063301632 …,2020-03-11 17:03:22,https://twitter.com/jeremyFLOWERS/status/1237786201370705920,Coronavirus
1237785321967726592,Kicheol,WHO declares the coronavirus outbreak a pandemic https://www.statnews.com/2020/03/11/who-declares-the-coronavirus-outbreak-a-pandemic/ … via @statnews,2020-03-11 16:59:52,https://twitter.com/kicheolkim/status/1237785321967726592,Coronavirus
1237784758442057734,Sal Mancuso,What is one thing the #coronavirus did that @realDonaldTrump couldn’t? Answer: Unite the country. #America #Outbreak #virus #Politics #CDC,2020-03-11 16:57:37,https://twitter.com/b8con/status/1237784758442057734,Coronavirus
1237784737214693378,GOAT 👐🏼,"Tell them u got the corona virus, works every time.",2020-03-11 16:57:32,https://twitter.com/pelayito__/status/1237784737214693378,Coronavirus
1237784597812752385,The Sage Grouse,"Two strategies: Mitigation focuses on people known to be infected or exposed.

#flatteningthecurve focuses on reducing transmission, which means less chance of overwhelming local medical systems.

#FlattenTheCurve #COVID19 #coronavirus #Corona",2020-03-11 16:56:59,https://twitter.com/MaybeImALeo/status/1237784597812752385,Coronavirus
1237783398346657793,Megan V. Winslow,Over at @Stanford for #Coronavirus-related photos. This place is a ghost town since classes went virtual. pic.twitter.com/TGuyDWmhBF – at Stanford Memorial Church,2020-03-11 16:52:13,https://twitter.com/meganvwinslow/status/1237783398346657793,Coronavirus
1237783189294202881,Ann Jones,WHO says the coronavirus can now be classed as a pandemic  https://mol.im/a/8101003  via @MailOnline,2020-03-11 16:51:23,https://twitter.com/AnnJones21710/status/1237783189294202881,Coronavirus
1237782821868957697,Chris Messina,Why would they? The economy was going great until the #coronavirus and it may recover by November.,2020-03-11 16:49:56,https://twitter.com/chrismessina/status/1237782821868957697,Coronavirus
1237782673067634688,rickrow,"Sorry, but you are reading the latest news of Fauci, Trump and coronavirus if you would even contemplate buying the dip.",2020-03-11 16:49:20,https://twitter.com/rickrow/status/1237782673067634688,Coronavirus
1237782627546828800,Robert Kinoshita,"How is your #portfolio doing today ?
#stockmarket #investing #investment #coronavirus #realestate #bullmarket #retirement #warrenbuffet #realestateagent #luxuryrealestate #luxurylifestyle @ San Francisco, California https://www.instagram.com/p/B9mbmkKBWbv/?igshid=1d777w88urpc3 …",2020-03-11 16:49:09,https://twitter.com/Kinoshitagroup/status/1237782627546828800,Coronavirus
1237782599201767429,Candice Nguyen,"I gotta say ever since companies started telling workers to stay home because of the #coronavirus, Bay Area traffic has...improved. ",2020-03-11 16:49:03,https://twitter.com/CandiceNguyenTV/status/1237782599201767429,Coronavirus
1237782408402833408,Lil Ollie Vert,"If you live in a fraternity house, you are immune to the coronavirus",2020-03-11 16:48:17,https://twitter.com/playboiollie/status/1237782408402833408,Coronavirus
1237782335405211648,alexios hamilton,"hopefully #sanfrancisco will have its #encore engagement late march through april ... from what i read @amazon cancelled moscone event amid #coronavirus fears, @PearlJam cancelled as well... hmm  ... postponed ?https://twitter.com/BookofMormon/status/1236056463388205056 …",2020-03-11 16:48:00,https://twitter.com/AlexiosHamilton/status/1237782335405211648,Coronavirus
1237782227192131584,Sailing Free,"World Health Organization declared Corona Virus  a pandemic,  only 2 months late. WHO is a UN organization and just like the rest of UN a totally failed and useless group of do nothing's that talk and talk and waste our money, disband it or at least pull out, kick them out of USA",2020-03-11 16:47:34,https://twitter.com/JimsBT510/status/1237782227192131584,Coronavirus
1237781846886252544,Maher Sinjary,"@WHO classifies #COVID19 as a pandemic.
#Coronavirus https://twitter.com/i/events/1219057585707315201 …",2020-03-11 16:46:03,https://twitter.com/mahersinjary/status/1237781846886252544,Coronavirus
1237781717873618945,"Leo Nissola, MD","Coronavirus is now declared a pandemic by @WHO. 
https://www.wsj.com/articles/u-s-coronavirus-cases-top-1-000-11583917794 … via @WSJ",2020-03-11 16:45:33,https://twitter.com/LeoNissolaMD/status/1237781717873618945,Coronavirus
1237780861006655489,Amir Sadeghian,I predict a lot of December babies this year  #coronavirus,2020-03-11 16:42:08,https://twitter.com/_amirabs/status/1237780861006655489,Coronavirus
1237780692131549186,Kalimah Priforce,Getting adult leadership back in the #WhiteHouse should be our number one priority. We don't need a fake conspiracy to take down #Trump. #Coronavirus is his #HurricaneKatrina and #JoeBiden will be his next natural… https://www.instagram.com/p/B9mbWaThfCG/?igshid=1rydhe3vlk22k …,2020-03-11 16:41:28,https://twitter.com/priforce/status/1237780692131549186,Coronavirus
1237780623772672002,The Sage Grouse,"Due to of lack of testing, decision makers are unsure whether to cancel large gatherings.

But if we EACH do what we can to increase our own social distance, we can accomplish the same thing and ""flatten the curve"" of transmission.

#FlattenTheCurve #COVID19 #coronavirus #Corona",2020-03-11 16:41:12,https://twitter.com/MaybeImALeo/status/1237780623772672002,Coronavirus
1237780226727235585,Michael Latham,"Yeah?!? Meanwhile Trump is working on tax breaks for yachts and golf carts! Good times. 
BBC News - Coronavirus confirmed as pandemic
https://www.bbc.co.uk/news/world-51839944 …",2020-03-11 16:39:37,https://twitter.com/tempusfugitive/status/1237780226727235585,Coronavirus
1237779725113671683,Dєνσηтαє|Pяιη¢є ✌🏾💙🏁,If you’ve been to Shisha after 2a you’re immune to the corona virus.. ,2020-03-11 16:37:37,https://twitter.com/GardenBoyPrince/status/1237779725113671683,Coronavirus
1237779414416363522,Clayton Garnier,Imagine making people pay for coronavirus news.... https://twitter.com/nytimes/status/1237483366938599424 …,2020-03-11 16:36:23,https://twitter.com/ClaytonGarnier/status/1237779414416363522,Coronavirus
1237778083794444288,Jardani Jovonovich,Lol I wish... my job sent me here to hunt and kill infected coronavirus people off that cruise ship that just landed yesterday In Oakland,2020-03-11 16:31:06,https://twitter.com/KingJaffeJoPHer/status/1237778083794444288,Coronavirus
1237777486194200577,Ro Parry,It’s official. @WHO just announced it the coronavirus is now a pandemic,2020-03-11 16:28:44,https://twitter.com/RougeParry/status/1237777486194200577,Coronavirus
1237777214378139648,Jesse Atkinson,Maybe round up all the press/articles about all the big companies doing WFH right now as well as articles about how easily coronavirus spreads and sent it to them along with “I’ll be WFH for the safety of myself and my community” or something.,2020-03-11 16:27:39,https://twitter.com/jsatk/status/1237777214378139648,Coronavirus
1237776914237947904,ANDRÉS BRENDER,"REPORTAJE:

 Aquí toda la info sobre los agentes del TSA que tienen coronavirus.

https://trib.al/iCsHxJ7 ",2020-03-11 16:26:27,https://twitter.com/abrenderT48/status/1237776914237947904,Coronavirus
1237776488671268866,Liquid Smoke,Sad thing is hells racist finna die from the #coronavirus and their people will still vote Trump,2020-03-11 16:24:46,https://twitter.com/brianknockin/status/1237776488671268866,Coronavirus
1237775867851321345,Knish🔜NOT SHIT,"They say washing your hands 5 times a day for at least 20 seconds cuts your likelihood of getting Coronavirus in half. I'm on a busy schedule, so I've been getting my 5 hand washes out of the way first thing in the morning ",2020-03-11 16:22:18,https://twitter.com/Knishkabob/status/1237775867851321345,Coronavirus
1237775690159669249,Micaela van Zwoll💃🏻,"It’s not. It’s intolerable. Don’t let the racists get to you. I mean, we could call it the cruise ship Coronavirus ... but we’re better than that. ",2020-03-11 16:21:35,https://twitter.com/MicaelaVanZwoll/status/1237775690159669249,Coronavirus
1237775467454717953,Ryan Flinn,"Boarding our @SouthwestAir flight to Burbank from Oakland: “folks, there just 39 of you for 143 seats...you do the math - take an aisle.” #coronavirus #travelintheageofcorona",2020-03-11 16:20:42,https://twitter.com/RS_Flinn/status/1237775467454717953,Coronavirus
1237775466020274179,Sailing Free,"In the time the Gov't and media have reported 30 deaths and 1050 cases of Corona Virus how many flu cases and deaths go virtually totally unreported and unnoticed by media and public. In this same 4 week period over 2,000,000 flu cases and 1000 + deaths have not alarmed anyone!",2020-03-11 16:20:42,https://twitter.com/JimsBT510/status/1237775466020274179,Coronavirus
1237775082409222145,toki,"they’re giving us flexibility in hours this week at work due to coronavirus stuff, and I’ve been using that to take an extra hour or two nap after a few early morning call-in meetings. it’s been helping me immensely",2020-03-11 16:19:11,https://twitter.com/biggreenlzrd/status/1237775082409222145,Coronavirus
1237774924242010113,Melany🦁,Todo era risa por los memes del coronavirus hasta que supe q van tres muertos en mi ciudad cerraron escuelas y empresas ,2020-03-11 16:18:33,https://twitter.com/meelarango_/status/1237774924242010113,Coronavirus
1237774041810751489,^THICKARRY DUFF^,"Y’all literally voted for the man who wants to leave 10 million uninsured even when #coronavirus out here wrecking half the world. God really out here like ,” y’all, I sent you my son Covid-19 and you wasted his gifts.” #M4AOrBust #m4a @JoeBiden",2020-03-11 16:15:02,https://twitter.com/TonyNativ/status/1237774041810751489,Coronavirus
1237773831508348928,Sailing Free,"@FoxNews  you and rest of media fan the flames of panic about Corona Virus , your huge ""tote"" board displaying cases and death numbers is despicable,  why not report flu numbers side by side which are 10 times as high, yet were not doing anything extraordinary this flu season,",2020-03-11 16:14:12,https://twitter.com/JimsBT510/status/1237773831508348928,Coronavirus
1237773688398688264,nik 🥂,The best part of coronavirus is being able to go to class with no pants on,2020-03-11 16:13:38,https://twitter.com/NIKTHEDUFFFFER/status/1237773688398688264,Coronavirus
