tweet_id,username,text,tweet_date,tweet_url,search_term
1237887364866818050,Robert S. Weiss,"Is that what Wall Street is saying by it’s performance the past 3 weeks - a loss of $5,000,000,000,000, just like that, with most of it caused by confusion, the Administration grossly mismanaging the crisis so far thereby causing its spread and a dose of the reality of COVID-19! https://twitter.com/realDonaldTrump/status/1237745593876873217 …",2020-03-11 23:45:21,https://twitter.com/rweiss8/status/1237887364866818050,COVID
1237886636844695554,Aimee Lorene,"@AgendaFreeTV would you please be able to report an update as to the 19 people let off the princess cruise in Oakland who tested positive for COVID-19?  This is near me, tia!",2020-03-11 23:42:27,https://twitter.com/AimeeLorenePSCP/status/1237886636844695554,COVID
1237885896642277377,babyboyholden,"today on my way home from sf, i came over the bay bridge and saw the “grand princess docked where i normally see cargo ships. #covid_19 #sadforthoseonboard #washhands #getwellsoon @… https://www.instagram.com/p/B9nLMP_n2DTRlyZyli9jbWFQ8HTf4HyXyUFtEY0/?igshid=122i3upd15j5a …",2020-03-11 23:39:31,https://twitter.com/babyboyholden/status/1237885896642277377,COVID
1237882082321297410,jon_koo,"The district announced the all time record with $5.97 million donation from parents this year. Yet, schools have no e-support for COVID-19 closure despite CDC suggestion. Where does the PiE Palo Alto Partners in Education money go?  https://www.cdc.gov/coronavirus/2019-ncov/downloads/Santa-Clara_Community_Mitigation.pdf … #coronavirus",2020-03-11 23:24:21,https://twitter.com/jon_koo/status/1237882082321297410,COVID
1237881978453540866,aisha,COVID-19 took everything from me and i ain’t even infected.,2020-03-11 23:23:57,https://twitter.com/aisha_jama101/status/1237881978453540866,COVID
1237881024467492864,A M I T H Ā B A,"Today I transcreated social media posts into Vietnamese, worked with an East Coast company to acquire communications software capable of reaching 60,000+ residents, and drafted a script for City Employees to inform Seniors about Covid-19. 

Feels good to help your community man",2020-03-11 23:20:09,https://twitter.com/allday_dno/status/1237881024467492864,COVID
1237880271120158722,Alexy Khrabrov and 2020 others,The rich are tweeting furiously about the covid because,2020-03-11 23:17:09,https://twitter.com/ChiefScientist/status/1237880271120158722,COVID
1237879743438925824,Tasman_Tech,"Dear valued tenants of #TasmanTech: In light of the ongoing COVID-19 outbreak, we will be making operational changes to keep you all safe/healthy (increased janitorial/cleaning, hand-sanitizing stations, daily evaluations regarding fitness center availability). Thank you.",2020-03-11 23:15:04,https://twitter.com/tasman_tech/status/1237879743438925824,COVID
1237879516585811968,Natbat 🦠 STAY HOME!,"Given that disease ecology, transmission & their evolution phylogenies is on the sylubus for our @Stanford Evolution class. I think our lecturer is relishing the fresh example of COVID-19! pic.twitter.com/sPE5hpXq92",2020-03-11 23:14:10,https://twitter.com/Natbat/status/1237879516585811968,COVID
1237876326943490052,MahaYoga Devi Dasi 🕉,"Are you confirmed for Covid 19? I’m sorry to hear of your predicament.  I’m 58, & have stage 4 lung cancer. I have a cold. - So, all Covid 19 symptoms except fever. I haven’t had a fever. There’s no chance of it being Covid, right?",2020-03-11 23:01:29,https://twitter.com/MahaYoga_108/status/1237876326943490052,COVID
1237875931525435394,Miguel 🇳🇮,"Dawg I was so juiced to for the grand opening this Saturday .... but Alameda county called us and said we can’t have any gatherings due to the Covid-19 ..

So grand opening cancelled. Sorry y’all. ",2020-03-11 22:59:55,https://twitter.com/MiggyfromTheBay/status/1237875931525435394,COVID
1237874643299516417,RIP TRELLYBO,It’s COVID SZN ,2020-03-11 22:54:48,https://twitter.com/wiseboomin/status/1237874643299516417,COVID
1237873954301210627,Reborn Fitness," COVID ANNOUNCEMENT  Please read and share with family and friends — Take care everyone and may we recover from Coronavirus soon  #covid2019 #coronavirus  
•
•
•
•
——————————
#RebornFitness #RebornFitness650… https://www.instagram.com/p/B9nFwisjaLB/?igshid=14i1gyviu5z8 …",2020-03-11 22:52:03,https://twitter.com/RebornFitness_/status/1237873954301210627,COVID
1237873646992887808,Ferment.Drink.Repeat,"COVID-19 got you down? Tired of working from home, but also worried about going out in large groups? We've got you covered! 

We've got GROWLERS!

Bring in a growler to be filled, or pick up one of ours and enjoy… https://www.instagram.com/p/B9nFnuAJeaF/?igshid=wrgl0txvsh18 …",2020-03-11 22:50:50,https://twitter.com/FDRepeat/status/1237873646992887808,COVID
1237872887467364355,Colton C. Strawser,"Hey Nonprofit/Public Admin Faculty - The @ARNOVA Teaching Section is in the process of assembling online teaching resources in response to many universities going online due to COVID-19. Check out the options, contribute, and stay healthy - https://tinyurl.com/t9ew8u4 ",2020-03-11 22:47:49,https://twitter.com/Colton_Strawser/status/1237872887467364355,COVID
1237869174082293763,Kevin Goebel 🏳️‍🌈,I keep hearing it different ways. Is COVID-19 pronounced with a soft “i” like “vivid” and “livid”? Or with a hard “e” sound like “need” or “feed”?,2020-03-11 22:33:04,https://twitter.com/kgoebel/status/1237869174082293763,COVID
1237868785622609927,Bruce Hoult,"The thing is, it doesn’t make any practical difference whether your friend has COVID-19 or not. With those symptoms they should be in bed staying away from people. If their temp goes over 103 F 39.4 C or they can’t breathe (spO2 under 90%) they should go to ER whatever it is.",2020-03-11 22:31:31,https://twitter.com/BruceHoult/status/1237868785622609927,COVID
1237864981317607425,Lish,Shit is getting real with the Covid-19...,2020-03-11 22:16:24,https://twitter.com/alishaajuliaa/status/1237864981317607425,COVID
1237863857277652994,SB,@COVID can we hear some news stories about people in China who recovered from the virus and are now immune to it and fine? thank u!,2020-03-11 22:11:56,https://twitter.com/_moonprismpwr_/status/1237863857277652994,COVID
1237887364866818050,Robert S. Weiss,"Is that what Wall Street is saying by it’s performance the past 3 weeks - a loss of $5,000,000,000,000, just like that, with most of it caused by confusion, the Administration grossly mismanaging the crisis so far thereby causing its spread and a dose of the reality of COVID-19! https://twitter.com/realDonaldTrump/status/1237745593876873217 …",2020-03-11 23:45:21,https://twitter.com/rweiss8/status/1237887364866818050,COVID
1237886636844695554,Aimee Lorene,"@AgendaFreeTV would you please be able to report an update as to the 19 people let off the princess cruise in Oakland who tested positive for COVID-19?  This is near me, tia!",2020-03-11 23:42:27,https://twitter.com/AimeeLorenePSCP/status/1237886636844695554,COVID
1237885896642277377,babyboyholden,"today on my way home from sf, i came over the bay bridge and saw the “grand princess docked where i normally see cargo ships. #covid_19 #sadforthoseonboard #washhands #getwellsoon @… https://www.instagram.com/p/B9nLMP_n2DTRlyZyli9jbWFQ8HTf4HyXyUFtEY0/?igshid=122i3upd15j5a …",2020-03-11 23:39:31,https://twitter.com/babyboyholden/status/1237885896642277377,COVID
1237882082321297410,jon_koo,"The district announced the all time record with $5.97 million donation from parents this year. Yet, schools have no e-support for COVID-19 closure despite CDC suggestion. Where does the PiE Palo Alto Partners in Education money go?  https://www.cdc.gov/coronavirus/2019-ncov/downloads/Santa-Clara_Community_Mitigation.pdf … #coronavirus",2020-03-11 23:24:21,https://twitter.com/jon_koo/status/1237882082321297410,COVID
1237881978453540866,aisha,COVID-19 took everything from me and i ain’t even infected.,2020-03-11 23:23:57,https://twitter.com/aisha_jama101/status/1237881978453540866,COVID
1237881024467492864,A M I T H Ā B A,"Today I transcreated social media posts into Vietnamese, worked with an East Coast company to acquire communications software capable of reaching 60,000+ residents, and drafted a script for City Employees to inform Seniors about Covid-19. 

Feels good to help your community man",2020-03-11 23:20:09,https://twitter.com/allday_dno/status/1237881024467492864,COVID
1237880271120158722,Alexy Khrabrov and 2020 others,The rich are tweeting furiously about the covid because,2020-03-11 23:17:09,https://twitter.com/ChiefScientist/status/1237880271120158722,COVID
1237879743438925824,Tasman_Tech,"Dear valued tenants of #TasmanTech: In light of the ongoing COVID-19 outbreak, we will be making operational changes to keep you all safe/healthy (increased janitorial/cleaning, hand-sanitizing stations, daily evaluations regarding fitness center availability). Thank you.",2020-03-11 23:15:04,https://twitter.com/tasman_tech/status/1237879743438925824,COVID
1237879516585811968,Natbat 🦠 STAY HOME!,"Given that disease ecology, transmission & their evolution phylogenies is on the sylubus for our @Stanford Evolution class. I think our lecturer is relishing the fresh example of COVID-19! pic.twitter.com/sPE5hpXq92",2020-03-11 23:14:10,https://twitter.com/Natbat/status/1237879516585811968,COVID
1237876326943490052,MahaYoga Devi Dasi 🕉,"Are you confirmed for Covid 19? I’m sorry to hear of your predicament.  I’m 58, & have stage 4 lung cancer. I have a cold. - So, all Covid 19 symptoms except fever. I haven’t had a fever. There’s no chance of it being Covid, right?",2020-03-11 23:01:29,https://twitter.com/MahaYoga_108/status/1237876326943490052,COVID
1237875931525435394,Miguel 🇳🇮,"Dawg I was so juiced to for the grand opening this Saturday .... but Alameda county called us and said we can’t have any gatherings due to the Covid-19 ..

So grand opening cancelled. Sorry y’all. ",2020-03-11 22:59:55,https://twitter.com/MiggyfromTheBay/status/1237875931525435394,COVID
1237874643299516417,RIP TRELLYBO,It’s COVID SZN ,2020-03-11 22:54:48,https://twitter.com/wiseboomin/status/1237874643299516417,COVID
1237873954301210627,Reborn Fitness," COVID ANNOUNCEMENT  Please read and share with family and friends — Take care everyone and may we recover from Coronavirus soon  #covid2019 #coronavirus  
•
•
•
•
——————————
#RebornFitness #RebornFitness650… https://www.instagram.com/p/B9nFwisjaLB/?igshid=14i1gyviu5z8 …",2020-03-11 22:52:03,https://twitter.com/RebornFitness_/status/1237873954301210627,COVID
1237873646992887808,Ferment.Drink.Repeat,"COVID-19 got you down? Tired of working from home, but also worried about going out in large groups? We've got you covered! 

We've got GROWLERS!

Bring in a growler to be filled, or pick up one of ours and enjoy… https://www.instagram.com/p/B9nFnuAJeaF/?igshid=wrgl0txvsh18 …",2020-03-11 22:50:50,https://twitter.com/FDRepeat/status/1237873646992887808,COVID
1237872887467364355,Colton C. Strawser,"Hey Nonprofit/Public Admin Faculty - The @ARNOVA Teaching Section is in the process of assembling online teaching resources in response to many universities going online due to COVID-19. Check out the options, contribute, and stay healthy - https://tinyurl.com/t9ew8u4 ",2020-03-11 22:47:49,https://twitter.com/Colton_Strawser/status/1237872887467364355,COVID
1237869174082293763,Kevin Goebel 🏳️‍🌈,I keep hearing it different ways. Is COVID-19 pronounced with a soft “i” like “vivid” and “livid”? Or with a hard “e” sound like “need” or “feed”?,2020-03-11 22:33:04,https://twitter.com/kgoebel/status/1237869174082293763,COVID
1237868785622609927,Bruce Hoult,"The thing is, it doesn’t make any practical difference whether your friend has COVID-19 or not. With those symptoms they should be in bed staying away from people. If their temp goes over 103 F 39.4 C or they can’t breathe (spO2 under 90%) they should go to ER whatever it is.",2020-03-11 22:31:31,https://twitter.com/BruceHoult/status/1237868785622609927,COVID
1237864981317607425,Lish,Shit is getting real with the Covid-19...,2020-03-11 22:16:24,https://twitter.com/alishaajuliaa/status/1237864981317607425,COVID
1237863857277652994,SB,@COVID can we hear some news stories about people in China who recovered from the virus and are now immune to it and fine? thank u!,2020-03-11 22:11:56,https://twitter.com/_moonprismpwr_/status/1237863857277652994,COVID
1237863259216068610,Marlene 👩🏻‍💻,"Amazing article for those of us that work for #nonprofit shelters. 

Nonprofits Who Can’t Cancel: The Ones that Serve Those at Greater Risk of COVID-19 https://nonprofitquarterly.org/nonprofits-who-cant-cancel-the-ones-that-serve-those-at-greater-risk-of-covid-19/ … via @npquarterly",2020-03-11 22:09:34,https://twitter.com/marju319/status/1237863259216068610,COVID
1237862282291367937,Rue Sonoma,"No one wants to get this, no one wishes for businesses to shut down — I have already heard of many small businesses struggling due to lack of orders and low show attendance during this CoVid-19 panic and it’s only… https://www.instagram.com/p/B9nAc8EJAzQ/?igshid=1w9bosay91amz …",2020-03-11 22:05:41,https://twitter.com/RuPiperDesigns/status/1237862282291367937,COVID
1237862275953733639,Cousin Glenn,"One positive takeaway from this Covid pandemic —

It’s taught A LOT of you proper, basic hygienic practices.",2020-03-11 22:05:39,https://twitter.com/glenn_frd/status/1237862275953733639,COVID
1237860869507125251,Berdie,COVID-19 is declared a pandemic. I’m still gonna make that hop across the big pond next week. WHOA!!!,2020-03-11 22:00:04,https://twitter.com/berdie_avion/status/1237860869507125251,COVID
1237859440943976449,Jay,Just got an email. We're supposed to work from home until next Friday due to someone at our office testing positive for covid-19. Damn. I work work well from home but get paranoid someone will think I'm slacking off and don't take breaks like I should lol,2020-03-11 21:54:23,https://twitter.com/MrBastos784/status/1237859440943976449,COVID
1237858863803551747,Gen X GRRRetch the Neon Lib,Medical triage for COVID 19 should include looking at social media. Did the person laugh it up at this and continue to go out? Back of the line for limited resources.,2020-03-11 21:52:06,https://twitter.com/Gretchen415/status/1237858863803551747,COVID
1237855475862929408,raven :-),"de anza says stuff like ""we care about the health/safety of our students""
maybe close the school before covid-19 continues to spread then? being tops in transfer won't matter if we're all sick.",2020-03-11 21:38:38,https://twitter.com/ravenlmao/status/1237855475862929408,COVID
1237854450112327690,frankyarriola,"COVID-19: The State & Future of Pandemics hosted by Singularity University  
March 16-18 
Register Here - https://www.crowdcast.io/e/covid-19-virtual-summit …
#COVID2019 #Pandemic #CoronaVirusUpdate… https://www.instagram.com/p/B9m85BNgSaj/?igshid=1frdv8i1xosb8 …",2020-03-11 21:34:33,https://twitter.com/frankyarriola/status/1237854450112327690,COVID
1237853408242970624,Jonathan,"Even though it was a unpopular and upfront decision, US President Donald Trump announced the travel restrictions of those from China! A decision minimizes the spread of covid-19 , liking those in EU now-uncontrollable. The cruise cases are controlled. The Wall street should give",2020-03-11 21:30:25,https://twitter.com/JonathanChen194/status/1237853408242970624,COVID
1237853285320540165,laiken w,Waiting on Disney to promote a pair of “Mickey Gloves” to the masses as a COVID-19 hygiene tip.,2020-03-11 21:29:56,https://twitter.com/laikenw/status/1237853285320540165,COVID
1237852220697096204,Robert S. Weiss,OMG - Cancelling the daily COVID-19 task force update is perhaps the dumbest signal Trump is in way over his head and totally doesn’t know what he is doing! https://twitter.com/realDonaldTrump/status/1237820042735226887 …,2020-03-11 21:25:42,https://twitter.com/rweiss8/status/1237852220697096204,COVID
1237844175678132230,Steve Chin,COVID-19 stats,2020-03-11 20:53:44,https://twitter.com/SteveChin1/status/1237844175678132230,COVID
1237843371562921986,Marcelo Díaz Viana Neto,"Here's a weird, but important thing:

The COVID-19 pandemic causes people to consider their own mortality. A variety of studies have shown that when we do this, even in subtle ways, we tend to get more conservative and cling to belief systems harder, like religion and patriotism.",2020-03-11 20:50:32,https://twitter.com/manyweare/status/1237843371562921986,COVID
1237840521394941958,Aditya Arun,What if I told you that “recommendations” follows the same algorithmic model that COVID is designed with - “spread through engagement”  pic.twitter.com/bA1R4xc3jT,2020-03-11 20:39:12,https://twitter.com/dzzlyzzltzzl/status/1237840521394941958,COVID
1237837662771269632,R. Scott Love,300M plus Americans will need COVID-19 vaccinations in the coming years along with all other key vaccinations - assume $200 for COVID-19 alone in the first years so maybe north of $60B for year one of shots not including other shots so we need a new kind of budget to defend us https://twitter.com/davewiner/status/1237824859411021824 …,2020-03-11 20:27:51,https://twitter.com/TheScottLove/status/1237837662771269632,COVID
1237837050092511232,Jason Tolkin,Covid-chorus,2020-03-11 20:25:25,https://twitter.com/jtolks/status/1237837050092511232,COVID
1237836695011115008,John DM,"@NicolleDWallace Considering what is happening in SF and in CA COVID-19 is very serious,  I am in 5 of high risk groups and have no information from White House. #COVID19 #DeadlineWH",2020-03-11 20:24:00,https://twitter.com/Libertine50/status/1237836695011115008,COVID
1237835996529639424,Rebecca Hass,"Pay-what-you-can Self Care Shift Sessions are back! ⁠⠀
⁠⠀
Like many people, you might be somewhere on the spectrum between paranoia/panic and generally unnerved by all of the uncertainty surrounding COVID-19 right… https://www.instagram.com/p/B9m0f-MnksW/?igshid=16dspigkv7rvr …",2020-03-11 20:21:14,https://twitter.com/rebeccahasspno/status/1237835996529639424,COVID
1237835421112922113,Marcus East,More useful analysis on COVID-19 from my super smart colleague @antoniogulli #COVID19 #italy #datahttps://twitter.com/antoniogulli/status/1237825499734433794 …,2020-03-11 20:18:56,https://twitter.com/marcuseast/status/1237835421112922113,COVID
1237834859130699777,R. Scott Love,Change your POV by changing your semantics - I personally call this a bio-war as every single human on Earth is a target for COVID-19 and it could possibly mean years of wins and losses @ScottGottliebMD @mattocko @BillGates @GavinNewsom @CDCDirector @DeptofDefense @MikeBloomberg,2020-03-11 20:16:42,https://twitter.com/TheScottLove/status/1237834859130699777,COVID
1237834080349302795,Crepe 'Em Coming,"Sara, myself, and all of Crepe 'Em Coming want to wish everyone good health and strong antibodies during this difficult COVID-19 situation.  At Crepe 'Em Coming, food safety and the safety and well-being of our… https://www.instagram.com/p/B9mzn-5jU5b/?igshid=jr4hwlijxt3u …",2020-03-11 20:13:37,https://twitter.com/CrepeEmComing/status/1237834080349302795,COVID
1237833201965346816,RooseveltG,"If you’ve drank from one of these, you’ve been vaccinated against COVID-19. Sorry millennials. pic.twitter.com/RHDvOZyMve",2020-03-11 20:10:07,https://twitter.com/49thKing/status/1237833201965346816,COVID
1237831450847662081,Sailing Free,"@BobEgelko  WHO says hot dogs, hamburgers, processed meat are cancer causing, let's see WHO the crackpot UN health organization that's taken 3 months to determine COVID 19 is a global health risk, hot dogs have been around over 100 years now a Euro based WHO-UN says stop eating pic.twitter.com/WISLklpPgK",2020-03-11 20:03:10,https://twitter.com/JimsBT510/status/1237831450847662081,COVID
1237829716154843136,aj,so glad i decided to come into the office today during the “suggest wfh due to covid 19” period cause this pulled pork at lunch is fire as fck,2020-03-11 19:56:16,https://twitter.com/alvnjn/status/1237829716154843136,COVID
1237826655562772480,Brick Resistant Oakland,"Covid-19
I will keep my hands clean, 
And I promise to wash (everything)
And I won’t touch my face; I will wash off all the trace
Of the virus 
Of COVID-19! https://twitter.com/sommarsaknife/status/1237244213424787457 …",2020-03-11 19:44:07,https://twitter.com/caramida/status/1237826655562772480,COVID
1237825236428558346,Alec,Hopefully this is the one where everyone involved finally becomes trapped in the maze for eternity. Or perhaps that’ll be during the inevitable Covid-19 episode.,2020-03-11 19:38:28,https://twitter.com/alecincode/status/1237825236428558346,COVID
1237825078848450560,"Not an expert, but...","I don’t blame Trump for COVID-19.

I blame him for the inadequate response of the Federal govt., squandering what little advance time we had while he spreads disinformation and only shows concern for himself and his re-election.",2020-03-11 19:37:51,https://twitter.com/jay2bell/status/1237825078848450560,COVID
1237821225054818304,Patrick Traughber,According to https://www.sfdph.org/dph/alerts/coronavirus.asp … there are no new confirmed cases of COVID-19 in San Francisco today.,2020-03-11 19:22:32,https://twitter.com/ptraughber/status/1237821225054818304,COVID
1237817177060732929,stevoncook,"Just finished a press conference w/ Superintendent Matthews, Mayor @LondonBreed and Dr. Colfax from the DPH to discuss the unfolding COVID-19 situation and how it relates to our public schools. We are working together to monitor the situation and keep our children safe. pic.twitter.com/H0xmK8uVuM – at San Francisco City Hall",2020-03-11 19:06:27,https://twitter.com/stevoncook/status/1237817177060732929,COVID
1237814536142352384,lɥɐpʇsǝM uǝʌǝʇS,Home from the dentist. Got the new front tooth installed. Already feeling like I might smile more often now. But the ‘on the way out the door’ kicker is they want to extract 4 of my wisdom teeth for the low price of (a month’s worth of rent) and COVID’s got my income shut down.,2020-03-11 18:55:57,https://twitter.com/swestdahl/status/1237814536142352384,COVID
1237809404109451264,Katherine Scott,"Shitpost of the day: Bernie shouldn't drop out. The boomer flu / Covid 19 is going to hit Biden's support base, hard. They're going to need us. They need to step aside and let medicare for all happen.",2020-03-11 18:35:33,https://twitter.com/kscottz/status/1237809404109451264,COVID
1237807866175578112,Eugene Wei,"Now that WHO has finally declared COVID-19 a global pandemic, I’ve also decided to declare the 3 Burrito Supremes I ordered from Taco Bell on Doordash 6 weeks ago to be a “bad idea”",2020-03-11 18:29:27,https://twitter.com/eugenewei/status/1237807866175578112,COVID
1237807709619019776,Spacely,Gotta love how 6 months ago our generation was hell bent on raiding Area 51 without a care in the world and now we’re all losing our shit over COVID-19 ,2020-03-11 18:28:49,https://twitter.com/Spacely_Music/status/1237807709619019776,COVID
1237806964152782848,A M I T H Ā B A,Working on Covid-19 stuff while listening to @billburr and @bertkreischer's podcast gives you the adrenaline we need as crisis communicators lololol – at San Jose City Hall,2020-03-11 18:25:52,https://twitter.com/allday_dno/status/1237806964152782848,COVID
1237805898434633729,Mr. Ato Walker,"All Hypothesis Welcome!!!! Tonight we solve the Covid-19 mystery!!!!
#thecaravanloungecomedyshow @ Caravan Lounge San Jose https://www.instagram.com/p/B9mk5cNjnRk/?igshid=8ndzbomm0se7 …",2020-03-11 18:21:38,https://twitter.com/MrWalkerComedy/status/1237805898434633729,COVID
1237805833112576000,mac mann-wood⁷,"I really hate having to ask, but my campus has shut down because of COVID-19. I was banking on my meal points, but the dining hall is almost entirely gone. If anyone can help me buy groceries, my Venmo is https://venmo.com/code?user_id=2163345171939328187 …",2020-03-11 18:21:22,https://twitter.com/macisariver/status/1237805833112576000,COVID
1237805067966676993,September Williams,Johns Hopkins Experts Brief Capitol Hill on Coronavirus (COVID-19) https://youtu.be/Pnk8DuAly9Y  via @YouTube,2020-03-11 18:18:20,https://twitter.com/bioethicsscreen/status/1237805067966676993,COVID
1237804758976454658,Catch Me Inside,"Being a middle aged #Queer I’m no stranger to fearing a deadly virus.  While I’m also afraid of Covid 19, I’m enjoying watching straight people panic. pic.twitter.com/0bsfjSL4bS",2020-03-11 18:17:06,https://twitter.com/Real_Housebear/status/1237804758976454658,COVID
1237803351326113792,R. Scott Love,"Team Biden will need a deep bench to deal with economic instability, on-going global bio-war against COVID-19 & then how to prosecute Trump & his corrupt family for their many crimes.  @JoeBiden @DNC @SenKamalaHarris @SenAmyKlobuchar @PreetBharara @SenatorBooker @MikeBloomberg",2020-03-11 18:11:30,https://twitter.com/TheScottLove/status/1237803351326113792,COVID
1237800268441346049,Mungochris the social distance cat,Kind of wild how quickly some companies change to respond to COVID-19 but when the same level of change needs to be done to stop climate we're always told it would be too disruptive and can't happen that fast,2020-03-11 17:59:15,https://twitter.com/ChrisTrampy/status/1237800268441346049,COVID
